{
  "$schema": "https://json-schema.org/draft/2020-12/schema",
  "type": "object",
  "additionalProperties": false,
  "required": [
    "overall_status",
    "issues",
    "requirement_results",
    "recommendations"
  ],
  "properties": {
    "overall_status": {
      "type": "string",
      "enum": [
        "pass",
        "warning",
        "fail"
      ]
    },
    "issues": {
      "type": "array",
      "items": {
        "type": "object",
        "additionalProperties": false,
        "required": [
          "severity",
          "artifact",
          "description"
        ],
        "properties": {
          "severity": {
            "type": "string",
            "enum": [
              "low",
              "medium",
              "high"
            ]
          },
          "artifact": {
            "type": "string"
          },
          "description": {
            "type": "string"
          },
          "evidence": {
            "type": "string"
          }
        }
      }
    },
    "requirement_results": {
      "type": "array",
      "items": {
        "type": "object",
        "additionalProperties": false,
        "required": [
          "requirement",
          "status",
          "evidence"
        ],
        "properties": {
          "requirement": {
            "type": "string"
          },
          "status": {
            "type": "string",
            "enum": [
              "pass",
              "fail",
              "unknown"
            ]
          },
          "evidence": {
            "type": "string"
          }
        }
      }
    },
    "recommendations": {
      "type": "array",
      "items": {
        "type": "string"
      }
    }
  }
}